<?xml version="1.0" encoding="utf-8"?>
<manifest identifier="qDJcFlA7sSZP1" xmlns="http://www.imsglobal.org/xsd/imscp_v1p1" xmlns:imsss="http://www.imsglobal.org/xsd/imsss" xmlns:adlcp="http://www.adlnet.org/xsd/adlcp_v1p3" xmlns:adlseq="http://www.adlnet.org/xsd/adlseq_v1p3" xmlns:adlnav="http://www.adlnet.org/xsd/adlnav_v1p3" xmlns:lom="http://ltsc.ieee.org/xsd/LOM" xmlns:xsi="http://www.w3.org/2001/XMLSchema-instance" xsi:schemaLocation="http://www.imsglobal.org/xsd/imscp_v1p1 imscp_v1p1.xsd http://www.imsglobal.org/xsd/imsss imsss_v1p0.xsd http://www.adlnet.org/xsd/adlcp_v1p3 adlcp_v1p3.xsd http://www.adlnet.org/xsd/adlseq_v1p3 adlseq_v1p3.xsd http://www.adlnet.org/xsd/adlnav_v1p3 adlnav_v1p3.xsd http://ltsc.ieee.org/xsd/LOM lom.xsd">
<metadata>
<schema>ADL SCORM</schema>
<schemaversion>2004 3rd Edition</schemaversion>
<lom:lom>
<lom:general>
<lom:title>
<lom:string>Paediatric First Aid (Refresher)</lom:string>
</lom:title>
</lom:general>
<lom:educational>
<lom:typicalLearningTime>
<lom:duration>PT1H0M0S</lom:duration>
</lom:typicalLearningTime>
</lom:educational>
</lom:lom>
</metadata>
<organizations default="paediatric_first_aid_(refresher)_organization">
<organization identifier="paediatric_first_aid_(refresher)_organization">
<title>Paediatric First Aid (Refresher)</title>
<item identifier="D4A62515-62F6-4477-9E51-088B2F64F797" identifierref="resource">
<title>Paediatric First Aid (Refresher)</title>
<imsss:sequencing>
<imsss:deliveryControls completionSetByContent="true" objectiveSetByContent="true"/>
</imsss:sequencing>
</item>
<imsss:sequencing>
<imsss:controlMode flow="true"/>
</imsss:sequencing>
</organization>
</organizations>
<resources>
<resource identifier="resource" type="webcontent" adlcp:scormType="sco" href="res/index.html">
<file href="res/index.html"/>
<file href="res/lms.js"/>
<file href="res/data/thmb1.jpg"/>
<file href="res/data/slide1.js"/>
<file href="res/data/slide1.css"/>
<file href="res/data/thmb2.jpg"/>
<file href="res/data/slide2.js"/>
<file href="res/data/slide2.css"/>
<file href="res/data/thmb3.png"/>
<file href="res/data/slide3.js"/>
<file href="res/data/slide3.css"/>
<file href="res/data/thmb4.png"/>
<file href="res/data/slide4.js"/>
<file href="res/data/slide4.css"/>
<file href="res/data/thmb5.png"/>
<file href="res/data/slide5.js"/>
<file href="res/data/slide5.css"/>
<file href="res/data/thmb6.png"/>
<file href="res/data/slide6.js"/>
<file href="res/data/slide6.css"/>
<file href="res/data/thmb7.png"/>
<file href="res/data/slide7.js"/>
<file href="res/data/slide7.css"/>
<file href="res/data/thmb8.png"/>
<file href="res/data/quiz1.js"/>
<file href="res/data/quiz1/fonts/fnt0.woff"/>
<file href="res/data/quiz1/fonts/fnt1.woff"/>
<file href="res/data/quiz1/fonts/fnt2.woff"/>
<file href="res/data/quiz1/fonts/fnt3.woff"/>
<file href="res/data/quiz1/fonts/fnt4.woff"/>
<file href="res/data/quiz1/images/quiz_bg_0.png"/>
<file href="res/data/thmb9.png"/>
<file href="res/data/slide9.js"/>
<file href="res/data/slide9.css"/>
<file href="res/data/thmb10.png"/>
<file href="res/data/slide10.js"/>
<file href="res/data/slide10.css"/>
<file href="res/data/thmb11.png"/>
<file href="res/data/slide11.js"/>
<file href="res/data/slide11.css"/>
<file href="res/data/thmb12.png"/>
<file href="res/data/slide12.js"/>
<file href="res/data/slide12.css"/>
<file href="res/data/thmb13.png"/>
<file href="res/data/slide13.js"/>
<file href="res/data/slide13.css"/>
<file href="res/data/thmb14.png"/>
<file href="res/data/slide14.js"/>
<file href="res/data/slide14.css"/>
<file href="res/data/thmb15.png"/>
<file href="res/data/slide15.js"/>
<file href="res/data/slide15.css"/>
<file href="res/data/thmb16.png"/>
<file href="res/data/slide16.js"/>
<file href="res/data/slide16.css"/>
<file href="res/data/thmb17.png"/>
<file href="res/data/slide17.js"/>
<file href="res/data/slide17.css"/>
<file href="res/data/thmb18.png"/>
<file href="res/data/quiz2.js"/>
<file href="res/data/quiz2/fonts/fnt0.woff"/>
<file href="res/data/quiz2/fonts/fnt1.woff"/>
<file href="res/data/quiz2/fonts/fnt2.woff"/>
<file href="res/data/quiz2/fonts/fnt3.woff"/>
<file href="res/data/quiz2/fonts/fnt4.woff"/>
<file href="res/data/quiz2/images/quiz_bg_0.png"/>
<file href="res/data/sound1.mp3"/>
<file href="res/data/sound2.mp3"/>
<file href="res/data/sound3.mp3"/>
<file href="res/data/sound4.mp3"/>
<file href="res/data/sound5.mp3"/>
<file href="res/data/sound6.mp3"/>
<file href="res/data/sound7.mp3"/>
<file href="res/data/sound8.mp3"/>
<file href="res/data/sound9.mp3"/>
<file href="res/data/sound10.mp3"/>
<file href="res/data/sound11.mp3"/>
<file href="res/data/sound12.mp3"/>
<file href="res/data/sound13.mp3"/>
<file href="res/data/quizplayer.js"/>
<file href="res/index.html"/>
<file href="res/data/player.js"/>
<file href="res/data/eraser.cur"/>
<file href="res/data/highlighter.cur"/>
<file href="res/data/marker.cur"/>
<file href="res/data/lock.cur"/>
<file href="res/data/browsersupport.js"/>
<file href="res/data/apple-touch-icon.png"/>
<file href="res/data/favicon.ico"/>
<file href="res/data/fnt0.woff"/>
<file href="res/data/fnt1.woff"/>
<file href="res/data/fnt2.woff"/>
<file href="res/data/fnt3.woff"/>
<file href="res/data/fnt4.woff"/>
<file href="res/data/fnt5.woff"/>
<file href="res/data/fnt6.woff"/>
<file href="res/data/fnt7.woff"/>
<file href="res/data/fnt8.woff"/>
<file href="res/data/html5-unsupported.html"/>
<file href="res/data/img0.png"/>
<file href="res/data/img1.png"/>
<file href="res/data/img10.png"/>
<file href="res/data/img11.png"/>
<file href="res/data/img12.png"/>
<file href="res/data/img13.png"/>
<file href="res/data/img14.png"/>
<file href="res/data/img15.png"/>
<file href="res/data/img16.png"/>
<file href="res/data/img17.png"/>
<file href="res/data/img18.png"/>
<file href="res/data/img19.png"/>
<file href="res/data/img2.png"/>
<file href="res/data/img20.png"/>
<file href="res/data/img21.png"/>
<file href="res/data/img3.png"/>
<file href="res/data/img4.png"/>
<file href="res/data/img5.png"/>
<file href="res/data/img6.png"/>
<file href="res/data/img7.png"/>
<file href="res/data/img8.png"/>
<file href="res/data/img9.png"/>
<file href="res/data/goodbye.html"/>
</resource>
</resources>
</manifest>
